{
  "schemaVersion": "1.0.0",
  "id": "evidence-synthetic-001",
  "source": { "url": "https://example.invalid/source", "title": "Synthetic source", "publisher": "Test fixture", "usageTerms": "Synthetic test data" },
  "consultedOn": "2026-07-18",
  "scope": { "gameVersion": "synthetic", "versionConfidence": "UNKNOWN", "serverType": "UNKNOWN" },
  "extractedText": "Synthetic text.",
  "interpretation": "Exercises the evidence contract only.",
  "confidence": "UNVERIFIED",
  "reviewStatus": "PENDING"
}
